{
  "schema_version": "ael.run-record/0.1",
  "object_type": "run_record",
  "run_id": "kizz:ael:run:council-generation-1:E1-C0",
  "study_ref": {
    "study_id": "kizz:ael:study:council-generation-1-heldout",
    "revision": 1,
    "uri": "../study-manifest.json",
    "sha256": "aad0f01c68fc7346f0a834e7039f0650af31a04f65ceee927312468b335e9206",
    "visibility": "public"
  },
  "condition_id": "C0",
  "task": {
    "task_pack_id": "engineering-council-generation-1-heldout",
    "task_id": "E1",
    "stratum": "routine-local",
    "role": "holdout"
  },
  "repeat_index": 1,
  "status": "valid",
  "runtime": {
    "harness": {
      "name": "codex-cli",
      "version": "0.147.0-alpha.6.5"
    },
    "model": {
      "provider": "OpenAI",
      "model_id": "gpt-5.6-sol",
      "effort": "xhigh",
      "immutable_revision_exposed": false
    },
    "sandbox": "read-only",
    "environment": {
      "ephemeral": true,
      "identity_available": false
    }
  },
  "usage": {
    "input_tokens": 11227,
    "cached_input_tokens": 8960,
    "output_tokens": 336,
    "reasoning_output_tokens": 75,
    "wall_time_ms": 18612
  },
  "outputs": [
    {
      "uri": "lifeos:labs:experiment:engineering-council-evaluation:2026-08-11:heldout:E1-C0:final-output",
      "sha256": "fa45d0183380d3fe3daafc4fc2ea927e495726b9dda2b3c43b3217d3e987976c",
      "revision": "2026-08-11",
      "visibility": "private"
    }
  ],
  "effects": [],
  "event_summary": {
    "captured": true,
    "event_count": 0,
    "authenticated_actor_ids": [],
    "limitations": [
      "The retained event stream did not expose authenticated subagent receiver IDs."
    ]
  },
  "integrity_issues": [],
  "source_refs": [
    {
      "uri": "lifeos:labs:experiment:engineering-council-evaluation:2026-08-11:heldout:E1-C0:capture",
      "sha256": "f6b0397ef5ae3c5f18bc54b0cdafcf35ebaf57f2a5562855172e0927669f3a26",
      "revision": "2026-08-11",
      "visibility": "private"
    }
  ]
}
