{
  "condition_id": "B0",
  "effects": [
    {
      "effect_type": "terminal_claim_report",
      "evidence_refs": [
        {
          "sha256": "e373f3325c6e9551889072a735f24ba51fe8621c9a822f9c9829188358a9200d",
          "uri": "../../freeze.json",
          "visibility": "public"
        }
      ],
      "outcome": "unknown",
      "target": "urn:kizz:ael:private:reporter:CI2-TS-01-B0"
    }
  ],
  "event_summary": {
    "authenticated_actor_ids": [],
    "captured": false,
    "event_count": 0,
    "limitations": [
      "Raw Codex events are retained privately; this record exposes hashes and counts only."
    ]
  },
  "integrity_issues": [
    "cell was not submitted"
  ],
  "object_type": "run_record",
  "outputs": [],
  "repeat_index": 1,
  "run_id": "kizz:ael:run:completion-integrity-activation-v2:revision:2:CI2-TS-01-B0",
  "runtime": {
    "context_sha256": "0000000000000000000000000000000000000000000000000000000000000000",
    "environment": {
      "digest": "afcc47533056678c8c0e2729437dc0152f38c1a1d127f0af9d520ba8378968aa",
      "ephemeral": true,
      "identity_available": true
    },
    "harness": {
      "name": "codex-cli",
      "version": "0.146.0"
    },
    "model": {
      "effort": "xhigh",
      "immutable_revision_exposed": false,
      "model_id": "gpt-5.6-sol",
      "provider": "OpenAI"
    },
    "sandbox": "docker-read-only-evidence-openai-proxy",
    "tool_policy_sha256": "7ee63ebd36a45e67e08e3f2744a00fdf407d664a5f065d4b2454306362ecc983"
  },
  "schema_version": "ael.run-record/0.1",
  "source_refs": [
    {
      "sha256": "e373f3325c6e9551889072a735f24ba51fe8621c9a822f9c9829188358a9200d",
      "uri": "../../freeze.json",
      "visibility": "public"
    }
  ],
  "status": "unrun",
  "study_ref": {
    "revision": 2,
    "sha256": "e8eb6d3056b766e2440e121472ebd5ff89a4079dc641688959c80691832f081a",
    "study_id": "kizz:ael:study:completion-integrity-activation-v2",
    "uri": "../../study-manifest.json",
    "visibility": "public"
  },
  "task": {
    "role": "calibration",
    "stratum": "typescript-config",
    "task_id": "CI2-TS-01",
    "task_pack_id": "completion-integrity-v2-activation"
  },
  "usage": {
    "cached_input_tokens": 0,
    "input_tokens": 0,
    "output_tokens": 0,
    "reasoning_output_tokens": 0,
    "wall_time_ms": 0
  }
}
