{
  "schema_version": "ael.run-record/0.1",
  "object_type": "run_record",
  "run_id": "kizz:ael:run:agent-skills-season-1:property-based-testing-v2:P-S02:S1:R01",
  "study_ref": {
    "study_id": "kizz:ael:study:agent-skills-season-1:property-based-testing",
    "revision": 2,
    "uri": "../../../manifests/property-based-testing-v2.study-manifest.json",
    "sha256": "48b4d8211412ad06123a27cee10cc7051a6a5d9e5d79d055fe98715ff36f6d62",
    "visibility": "public"
  },
  "condition_id": "S1",
  "task": {
    "task_pack_id": "property-based-testing-v2-screening",
    "task_id": "P-S02",
    "stratum": "serialization-roundtrip",
    "role": "screening"
  },
  "repeat_index": 1,
  "status": "valid",
  "runtime": {
    "harness": {
      "name": "codex-cli",
      "version": "0.146.0"
    },
    "model": {
      "provider": "OpenAI",
      "model_id": "gpt-5.6-sol",
      "effort": "xhigh",
      "immutable_revision_exposed": false
    },
    "sandbox": "restricted outer Docker; Codex inner sandbox disabled",
    "environment": {
      "ephemeral": true,
      "identity_available": true,
      "digest": "f5ebad21373b16799a4bb0189d917856280cca8394c25967c95d612b6b61ac08"
    },
    "context_sha256": "080e7f41f48a1139aac15711d565c99603b707def3b6017faea13b9f693cf337"
  },
  "usage": {
    "input_tokens": 257727,
    "cached_input_tokens": 233984,
    "output_tokens": 5363,
    "reasoning_output_tokens": 2579,
    "wall_time_ms": 161892
  },
  "outputs": [
    {
      "uri": "urn:kizz:ael:private-run:pbt-v2:pbt-v2:P-S02:S1:1:candidate",
      "sha256": "080e7f41f48a1139aac15711d565c99603b707def3b6017faea13b9f693cf337",
      "revision": "property-based-testing-v2-pilot-1",
      "visibility": "private"
    }
  ],
  "effects": [],
  "event_summary": {
    "captured": true,
    "event_count": 38,
    "authenticated_actor_ids": [],
    "limitations": [
      "The provider did not expose an immutable model revision.",
      "Raw tasks, events, candidates, and evaluator outputs remain private and are represented by hashes.",
      "Encrypted provider traffic was not inspected."
    ]
  },
  "integrity_issues": [
    "The maintainer-approved reusable ChatGPT credential was readable by the Codex process; only frozen maintainer-controlled inputs were used."
  ],
  "source_refs": [
    {
      "uri": "urn:kizz:ael:private-run:pbt-v2:pbt-v2:P-S02:S1:1:events",
      "sha256": "1a5c7525fed0d27f03cbad11a0f4c809c213da68a95f14a88dc04d792c01040e",
      "revision": "property-based-testing-v2-pilot-1",
      "visibility": "private"
    },
    {
      "uri": "urn:kizz:ael:private-run:pbt-v2:pbt-v2:P-S02:S1:1:invocation",
      "sha256": "6bbc7c59a0b0688a019d9bf28896f6ac04f02bb83ec4f05ec5dce60014e7c0a9",
      "revision": "property-based-testing-v2-pilot-1",
      "visibility": "private"
    },
    {
      "uri": "urn:kizz:ael:private-run:pbt-v2:pbt-v2:P-S02:S1:1:score",
      "sha256": "9382c077ab0026448879c280f257cc1a0d279620681649562b6ef81acfcb5e2d",
      "revision": "property-based-testing-v2-pilot-1",
      "visibility": "private"
    }
  ]
}
